{
  "schema_version": "indicator-sequence.v1",
  "data_source": "synthetic", "test_only": true,
  "alpha": 0.3, "start_timestamp_us": 0, "window_duration_us": 20000000,
  "raw_values": [1, 1, null, 1, 1, 1],
  "expected_values": [1, 1, null, 1, 1, 1],
  "expected_levels": ["high", "high", "unavailable", "high", "high", "high"],
  "expected_events": ["none", "none", "none", "none", "none", "offer_break"],
  "expected_active": [false, false, false, false, false, true],
  "expected_high_counts": [1, 2, 0, 1, 2, 3]
}
