{
  "schema_version": "indicator-sequence.v1",
  "data_source": "synthetic", "test_only": true,
  "alpha": 0.3, "start_timestamp_us": 0, "window_duration_us": 20000000,
  "raw_values": [1, 1, 1, 0, 0, 0],
  "expected_values": [1, 1, 1, 0.7, 0.49, 0.343],
  "expected_levels": ["high", "high", "high", "high", "moderate", "low"],
  "expected_events": ["none", "none", "offer_break", "none", "none", "released"],
  "expected_active": [false, false, true, true, true, false],
  "expected_high_counts": [1, 2, 3, 3, 0, 0]
}
